comment_sentence_id,class,comment_sentence,partition,instance_type,category,pre_sentence
812,TemplateDoesNotExist,backend,0,0,Expand,backend
388,Individual,corresponding raw id widget won t have a magnifying glass link to select,0,0,Expand,corresponding raw id widget won t have a magnifying glass link to select
5933,PreparedRequest,"the fully mutable class preparedrequest preparedrequest object,",0,0,Expand,the fully mutable class preparedrequest preparedrequest object
5684,Unfold,and math represent arbitrary spatial dimensions.,0,0,Expand,and math represent arbitrary spatial dimensions
5727,Unfold,class torch^nn.fold calculates each combined value in the resulting,0,0,Expand,class torch nn fold calculates each combined value in the resulting
4546,BCEWithLogitsLoss,output^backward,0,0,Expand,output backward
3181,MemcachedBytecodeCache,timeout the timeout of the key.,0,0,Expand,timeout the timeout of the key
5896,UseOptimizer,with useoptimizer weight weight optim,0,0,Expand,with useoptimizer weight weight optim
5213,ExternalInitializer,executed.,0,0,Expand,executed
5090,EmbeddingBag,supported when mode max .,0,0,Expand,supported when mode max
2050,PlotAccessor,"if true, plot colorbar only relevant for scatter and hexbin",0,0,Expand,if true plot colorbar only relevant for scatter and hexbin
5053,EmbeddingBag,"computes sums or means of bags of embeddings, without instantiating the",0,0,Expand,computes sums or means of bags of embeddings without instantiating the
2230,SQLiteTable,patch the sqltable for fallback support.,0,0,Expand,patch the sqltable for fallback support
4053,SkipTo,sev cosmetic,0,0,Expand,sev cosmetic
513,MigrationGraph,this is to support the squash feature.,0,0,Expand,this is to support the squash feature
3743,Request,"list of tuples key, value is provided, form encoding will",0,0,Expand,list of tuples key value is provided form encoding will
2633,Environment,undefined,0,0,Expand,undefined
4730,Conv3d,concatenated.,0,0,Expand,concatenated
4792,Conv3d,examples,0,0,Expand,examples
256,ChunkIter,an iterable that will yield chunks of data.,0,0,Expand,an iterable that will yield chunks of data
2890,FollowedBy,"attr expr group label suppress oneormore data word, stopon label ^setparseaction ^join",0,0,Expand,attr expr group label suppress oneormore data word stopon label setparseaction join
5071,EmbeddingBag,"max norm float, optional if given, each embedding vector with norm larger than attr max norm",0,0,Expand,max norm float optional if given each embedding vector with norm larger than attr max norm
5898,UseOptimizer,"with useoptimizer default optim, bias bias optim,",0,0,Expand,with useoptimizer default optim bias bias optim
3749,Request,import requests,0,0,Expand,import requests
4247,Adam,"weight decay float, optional weight decay l2 penalty default 0",0,0,Expand,weight decay float optional weight decay l2 penalty default 0
4274,Adamax,it has been proposed in adam a method for stochastic optimization .,0,0,Expand,it has been proposed in adam a method for stochastic optimization
2271,StringArray,notes,0,0,Expand,notes
945,Audio,autoplay bool,0,0,Expand,autoplay bool
4223,Adadelta,"weight decay float, optional weight decay l2 penalty default 0",0,0,Expand,weight decay float optional weight decay l2 penalty default 0
2409,Argument,they generally,0,0,Expand,they generally
4020,SkipTo,failon default none define expressions that are not allowed to be,0,0,Expand,failon default none define expressions that are not allowed to be
4302,AdaptiveMaxPool3d,"d, h and w can be either a int , or none which means the size will",0,0,Expand,d h and w can be either a int or none which means the size will
3266,NotAny,ident and or not word alphas,0,0,Expand,ident and or not word alphas
1879,IntegerArray,we represent an integerarray with 2 numpy arrays,0,0,Expand,we represent an integerarray with 2 numpy arrays
5775,Unfold,"# or equivalently and avoiding a copy ,",0,0,Expand,or equivalently and avoiding a copy
2880,FollowedBy,expression matches at the current position.,0,0,Expand,expression matches at the current position
325,DisallowedModelAdminToField,invalid to field was passed to admin view via url query string,0,0,Expand,invalid to field was passed to admin view via url query string
3737,Request,if a dictionary or,0,0,Expand,if a dictionary or
3386,Option,have some extra features that arguments don t have.,0,0,Expand,have some extra features that arguments don t have
5742,Unfold,fold nn^fold output size .,0,0,Expand,fold nn fold output size
3728,ReadError,raised when an archive cannot be read,0,0,Expand,raised when an archive cannot be read
3886,Retry,the requests occurred.,0,0,Expand,the requests occurred
592,MultiPartParser,a rfc2388 multipart form data parser.,0,0,Expand,a rfc2388 multipart form data parser
203,BaseDatabaseSchemaEditor,"renaming, index fiddling, and so on.",0,0,Expand,renaming index fiddling and so on
5599,Task,with ops^task instance exit,0,0,Expand,with ops task instance exit
4026,SkipTo,# severity description days open,0,0,Expand,severity description days open
4316,AdaptiveMaxPool3d,# target output size of 7x9x8,0,0,Expand,target output size of 7x9x8
2944,HebrewProber,it reduces any sequence of such characters to a single space.,0,0,Expand,it reduces any sequence of such characters to a single space
5259,LBFGS,max iter int maximal number of iterations per optimization step,0,0,Expand,max iter int maximal number of iterations per optimization step
5243,LBFGS,"implements l bfgs algorithm, heavily inspired by minfunc",0,0,Expand,implements l bfgs algorithm heavily inspired by minfunc
920,Audio,numpy 2d array containing waveforms for each channel.,0,0,Expand,numpy 2d array containing waveforms for each channel
937,Audio,the original source be referenced.,0,0,Expand,the original source be referenced
3815,Retry,retries can be disabled by passing false,0,0,Expand,retries can be disabled by passing false
2005,PlotAccessor,density same as kde,0,0,Expand,density same as kde
5752,Unfold,"when the divisor tensor contains no zero elements, then",0,0,Expand,when the divisor tensor contains no zero elements then
841,TestImageFieldFile,was opened.,0,0,Expand,was opened
5352,MultiLabelMarginLoss,batch element instead and ignores attr size average .,0,0,Expand,batch element instead and ignores attr size average
4461,BCEWithLogitsLoss,class.,0,0,Expand,class
5717,Unfold,"dilation int or tuple, optional a parameter that controls the",0,0,Expand,dilation int or tuple optional a parameter that controls the
1479,StorageBackedLongs,"sbl storagebackedlongs storage, sbl",0,0,Expand,sbl storagebackedlongs storage sbl
363,FrenchTestCase,tests using the french translations of the sampleproject.,0,0,Expand,tests using the french translations of the sampleproject
2581,Environment,defaults to % .,0,0,Expand,defaults to
2257,StringArray,"currently, this expects an object dtype ndarray",0,0,Expand,currently this expects an object dtype ndarray
2068,PlotAccessor,"when using a secondary y axis, automatically mark the column",0,0,Expand,when using a secondary y axis automatically mark the column
2603,Environment,trim blocks,0,0,Expand,trim blocks
465,LogoutThenLoginTests,tests for the logout then login view,0,0,Expand,tests for the logout then login view
486,Migration,"dependencies a list of tuples of app path, migration name",0,0,Expand,dependencies a list of tuples of app path migration name
3087,Markup,passing an object that implements html will wrap the,0,0,Expand,passing an object that implements html will wrap the
947,Audio,default is false .,0,0,Expand,default is false
1998,PlotAccessor,the kind of plot to produce,0,0,Expand,the kind of plot to produce
5637,TestQuantizedLinear,tests the correctness of the quantized linear and linear relu op.,0,0,Expand,tests the correctness of the quantized linear and linear relu op
3840,Retry,limit this to avoid infinite redirect,0,0,Expand,limit this to avoid infinite redirect
4281,Adamax,"eps float, optional term added to the denominator to improve",0,0,Expand,eps float optional term added to the denominator to improve
680,OverwritingStorage,overwrite existing files instead of appending a suffix to generate an,0,0,Expand,overwrite existing files instead of appending a suffix to generate an
4544,BCEWithLogitsLoss,target torch^empty 3 ^random 2,0,0,Expand,target torch empty 3 random 2
5725,Unfold,called im2col .,0,0,Expand,called im2col
2064,PlotAccessor,detail.,0,0,Expand,detail
5565,StackTransform,in a way compatible with func torch^stack .,0,0,Expand,in a way compatible with func torch stack
2558,Distribution,"either way, it must have some metadata, so that s all that s needed",0,0,Expand,either way it must have some metadata so that s all that s needed
5079,EmbeddingBag,"mode string, optional sum , mean or max .",0,0,Expand,mode string optional sum mean or max
5716,Unfold,default 0,0,0,Expand,default 0
3083,Markup,"markup^escape hello, em world em !",0,0,Expand,markup escape hello em world em
5768,Unfold,"torch^size 2, 30, 4",0,0,Expand,torch size 2 30 4
1226,_MockPOP3,"true, false",0,0,Expand,true false
939,Audio,audio to playable later with no internet connection in the notebook.,0,0,Expand,audio to playable later with no internet connection in the notebook
219,BCryptSHA256PasswordHasher,this is considered by many to be the most secure algorithm but you,0,0,Expand,this is considered by many to be the most secure algorithm but you
2052,PlotAccessor,position float,0,0,Expand,position float
890,XFrameOptionsDecoratorsTests,tests for the x frame options decorators.,0,0,Expand,tests for the x frame options decorators
5085,EmbeddingBag,default mean,0,0,Expand,default mean
798,StaticFilesHandler,"defined by the static url setting, and serves those files.",0,0,Expand,defined by the static url setting and serves those files
1111,Magics,must,0,0,Expand,must
926,Audio,bytestring containing raw pcm data or,0,0,Expand,bytestring containing raw pcm data or
1517,VCardStore,u guy,0,0,Expand,u guy
4971,CyclicLR,scheduler^step,0,0,Expand,scheduler step
5468,Poisson,example,0,0,Expand,example
2825,FileMetadata,usage,0,0,Expand,usage
4718,Conv3d,attr padding controls the amount of implicit zero paddings on both,0,0,Expand,attr padding controls the amount of implicit zero paddings on both
136,BaseCommand,prior to executing the command.,0,0,Expand,prior to executing the command
2046,PlotAccessor,colormap to select colors from.,0,0,Expand,colormap to select colors from
5937,PreparedRequest,import requests,0,0,Expand,import requests
4523,BCEWithLogitsLoss,default true,0,0,Expand,default true
4514,BCEWithLogitsLoss,ignored,0,0,Expand,ignored
2602,Environment,versionadded 22,0,0,Expand,versionadded 22
5055,EmbeddingBag,"for bags of constant length and no attr per sample weights , this class",0,0,Expand,for bags of constant length and no attr per sample weights this class
2071,PlotAccessor,"if true, boolean values can be plotted.",0,0,Expand,if true boolean values can be plotted
3020,InternalName,you cannot create these nodes,0,0,Expand,you cannot create these nodes
2031,PlotAccessor,"loglog bool or sym , default false",0,0,Expand,loglog bool or sym default false
2276,StringArray,stringarray,0,0,Expand,stringarray
4391,BatchNorm1d,default true,0,0,Expand,default true
4756,Conv3d,"stride int or tuple, optional stride of the convolution.",0,0,Expand,stride int or tuple optional stride of the convolution
5600,Task,"ops^add globl, local , globl",0,0,Expand,ops add globl local globl
1498,Vcard,display a single vcard,0,0,Expand,display a single vcard
1197,YouTubeVideo,https developers^google.com youtube player parameters#parameters,0,0,Expand,https developers google com youtube player parameters parameters
4507,BCEWithLogitsLoss,"size average bool, optional deprecated see attr reduction .",0,0,Expand,size average bool optional deprecated see attr reduction
2848,FileSystemLoader,loads templates from the file system.,0,0,Expand,loads templates from the file system
2515,Context_,class undefined object for missing variables.,0,0,Expand,class undefined object for missing variables
1589,BooleanArray,values numpy^ndarray,0,0,Expand,values numpy ndarray
1269,ConfigDict,"a sanity checking, self documenting dictionary of program settings.",0,0,Expand,a sanity checking self documenting dictionary of program settings
129,BaseCommand,default value is,0,0,Expand,default value is
816,TemplateDoesNotExist,this,0,0,Expand,this
4013,SkipTo,expression is found.,0,0,Expand,expression is found
3678,PoolManager,"r manager^request get , http google^com",0,0,Expand,r manager request get http google com
951,Audio,default is true .,0,0,Expand,default is true
115,BaseCommand,message to stderr .,0,0,Expand,message to stderr
5505,ResNetBuilder,helper class for constructing residual blocks.,0,0,Expand,helper class for constructing residual blocks
109,BaseCommand,output produced by handle will be printed to standard,0,0,Expand,output produced by handle will be printed to standard
2006,PlotAccessor,area area plot,0,0,Expand,area area plot
4162,_OpNamespace,3,0,0,Expand,3
970,Audio,audio filename path to sound^ogg,0,0,Expand,audio filename path to sound ogg
361,FootNote,model added for ticket 19838,0,0,Expand,model added for ticket 19838
4511,BCEWithLogitsLoss,"some losses, there are multiple elements per sample.",0,0,Expand,some losses there are multiple elements per sample
1444,Event,this is a single event in the event log.,0,0,Expand,this is a single event in the event log
2951,HebrewProber,built.,0,0,Expand,built
1307,ConfigDict,pot carrots,0,0,Expand,pot carrots
4538,BCEWithLogitsLoss,output scalar.,0,0,Expand,output scalar
4717,Conv3d,attr stride controls the stride for the cross correlation.,0,0,Expand,attr stride controls the stride for the cross correlation
2273,StringArray,examples,0,0,Expand,examples
2508,Context_,func contextfunction s get the active context passed as first argument,0,0,Expand,func contextfunction s get the active context passed as first argument
4501,BCEWithLogitsLoss,"criterion output, target # log sigmoid 0999",0,0,Expand,criterion output target log sigmoid 0999
3519,ParseResults,# date str integer year integer month integer day,0,0,Expand,date str integer year integer month integer day
689,Permission,the permissions system provides a way to assign permissions to specific,0,0,Expand,the permissions system provides a way to assign permissions to specific
2850,FileSystemLoader,in folders on the file system and is the preferred way to load them.,0,0,Expand,in folders on the file system and is the preferred way to load them
5470,Poisson,m^sample,0,0,Expand,m sample
5598,Task,"ops^copy globl, local",0,0,Expand,ops copy globl local
5719,Unfold,neighborhood.,0,0,Expand,neighborhood
2624,Environment,extensions,0,0,Expand,extensions
4796,Conv3d,"m nn^conv3d 16, 33, 3, 5, 2 , stride 2, 1, 1 , padding 4, 2, 0",0,0,Expand,m nn conv3d 16 33 3 5 2 stride 2 1 1 padding 4 2 0
4644,BuildType,arguments,0,0,Expand,arguments
5923,YellowFinOptimizer,yellowfin an automatic tuner for momentum sgd,0,0,Expand,yellowfin an automatic tuner for momentum sgd
5580,Subset,indices sequence indices in the whole set selected for subset,0,0,Expand,indices sequence indices in the whole set selected for subset
4110,TokenStreamIterator,the iterator for tokenstreams.,0,0,Expand,the iterator for tokenstreams
3867,Retry,urllib3 will sleep for,0,0,Expand,urllib3 will sleep for
4044,SkipTo,"101 , critical , intermittent system crash , 6",0,0,Expand,101 critical intermittent system crash 6
3854,Retry,idempotent multiple requests with the same parameters end with the,0,0,Expand,idempotent multiple requests with the same parameters end with the
3260,NotAny,notany always returns,0,0,Expand,notany always returns
3994,Session,s requests^session,0,0,Expand,s requests session
5647,TransformerEncoderLayer,attention is all you need.,0,0,Expand,attention is all you need
4039,SkipTo,string data desc sep,0,0,Expand,string data desc sep
975,Audio,.,0,0,Expand,nan
1228,_MockPOP3,"msg 1 , msg 2",0,0,Expand,msg 1 msg 2
916,Audio,parameters,0,0,Expand,parameters
3863,Retry,param float backoff factor,0,0,Expand,param float backoff factor
929,Audio,"if a filename or url is used, the format support will be browser",0,0,Expand,if a filename or url is used the format support will be browser
2592,Environment,the string marking the end of a comment.,0,0,Expand,the string marking the end of a comment
2004,PlotAccessor,kde kernel density estimation plot,0,0,Expand,kde kernel density estimation plot
968,Audio,audio url http www^w3schools^com html horse^ogg,0,0,Expand,audio url http www w3schools com html horse ogg
4669,ConstantPad3d,pads the input tensor boundaries with a constant value.,0,0,Expand,pads the input tensor boundaries with a constant value
321,DblFromGeom,in by reference as the last argument.,0,0,Expand,in by reference as the last argument
2087,PlotAccessor,see matplotlib documentation online for more on this subject,0,0,Expand,see matplotlib documentation online for more on this subject
3706,PrefixLoader,app2 packageloader mypackage^app2,0,0,Expand,app2 packageloader mypackage app2
820,TemplateDoesNotExist,chain,0,0,Expand,chain
2043,PlotAccessor,"fontsize int, default none",0,0,Expand,fontsize int default none
5117,EmbeddingBag,# an embedding module containing 10 tensors of size 3,0,0,Expand,an embedding module containing 10 tensors of size 3
2559,Distribution,for construction.,0,0,Expand,for construction
1593,BooleanArray,indicates missing .,0,0,Expand,indicates missing
2877,FollowedBy,lookahead matching of the given parse expression.,0,0,Expand,lookahead matching of the given parse expression
2501,Context_,automatically at various stages of the template evaluation and should not,0,0,Expand,automatically at various stages of the template evaluation and should not
1481,StorageBackedLongs,TRUE,0,0,Expand,TRUE
1730,CategoricalIndex,make a copy of input ndarray.,0,0,Expand,make a copy of input ndarray
4275,Adamax,arguments,0,0,Expand,arguments
2065,PlotAccessor,"xerr dataframe, series, array like, dict and str",0,0,Expand,xerr dataframe series array like dict and str
3752,Request,preparedrequest get,0,0,Expand,preparedrequest get
4793,Conv3d,# with square kernels and equal stride,0,0,Expand,with square kernels and equal stride
233,BoundWidget,label for radio^id for label,0,0,Expand,label for radio id for label
2609,Environment,if this is set to true leading spaces and tabs are stripped,0,0,Expand,if this is set to true leading spaces and tabs are stripped
5472,Poisson,args,0,0,Expand,args
1651,CategoricalDtype,none can be used to maintain the ordered value of existing categoricals when,0,0,Expand,none can be used to maintain the ordered value of existing categoricals when
3022,InternalName,meth jinja2^parser.parser^free identifier method that creates,0,0,Expand,meth jinja2 parser parser free identifier method that creates
1109,Magics,.,0,0,Expand,nan
5749,Unfold,and dtype of the input,0,0,Expand,and dtype of the input
943,Audio,the sampling rate of the raw data.,0,0,Expand,the sampling rate of the raw data
5342,MultiLabelMarginLoss,if the field attr size average,0,0,Expand,if the field attr size average
5929,AuthBase,base class that all auth implementations derive from,0,0,Expand,base class that all auth implementations derive from
4314,AdaptiveMaxPool3d,"input torch^randn 1, 64, 10, 9, 8",0,0,Expand,input torch randn 1 64 10 9 8
2388,And,integer word nums,0,0,Expand,integer word nums
2020,PlotAccessor,axis grid lines.,0,0,Expand,axis grid lines
1871,Holiday,for observance.,0,0,Expand,for observance
2450,CaseInsensitiveDict,"however, querying and contains",0,0,Expand,however querying and contains
3244,Module_six_moves_urllib_response,lazy loading of moved objects in six^moves.urllib response,0,0,Expand,lazy loading of moved objects in six moves urllib response
588,ModelSignal,signal subclass that allows the sender to be lazily specified as a string,0,0,Expand,signal subclass that allows the sender to be lazily specified as a string
4500,BCEWithLogitsLoss,criterion torch^nn.bcewithlogitsloss pos weight pos weight,0,0,Expand,criterion torch nn bcewithlogitsloss pos weight pos weight
3328,omdict,key parameter has been added to these methods,0,0,Expand,key parameter has been added to these methods
2436,CallBlock,the unnamed macro as caller argument this node holds.,0,0,Expand,the unnamed macro as caller argument this node holds
4012,SkipTo,token for skipping over all undefined text until the matched,0,0,Expand,token for skipping over all undefined text until the matched
4021,SkipTo,"included in the skipped test if found before the target expression is found,",0,0,Expand,included in the skipped test if found before the target expression is found
4686,ConstantPad3d,"m nn^constantpad3d 3, 35",0,0,Expand,m nn constantpad3d 3 35
5700,Unfold,gives all values within a certain block.,0,0,Expand,gives all values within a certain block
5650,TransformerEncoderLayer,users may modify or implement,0,0,Expand,users may modify or implement
4752,Conv3d,args,0,0,Expand,args
3848,Retry,"these are retries made on responses, where status code matches",0,0,Expand,these are retries made on responses where status code matches
329,Dumpdata,tests for dumpdata management command.,0,0,Expand,tests for dumpdata management command
2025,PlotAccessor,"logx bool or sym , default false",0,0,Expand,logx bool or sym default false
5221,FisherSnedecor,"m fishersnedecor torch^tensor 10 , torch^tensor 20",0,0,Expand,m fishersnedecor torch tensor 10 torch tensor 20
2580,Environment,the string marking the end of a block.,0,0,Expand,the string marking the end of a block
879,WindowFrame,model the frame clause in window expressions.,0,0,Expand,model the frame clause in window expressions
3515,ParseResults,date str integer^setresultsname year,0,0,Expand,date str integer setresultsname year
1591,BooleanArray,mask numpy^ndarray,0,0,Expand,mask numpy ndarray
4366,BatchNorm1d,classes and the conventional notion of momentum.,0,0,Expand,classes and the conventional notion of momentum
2344,TestFromTuples,tests specific to intervalindex^from tuples,0,0,Expand,tests specific to intervalindex from tuples
4346,BatchNorm1d,applies batch normalization over a 2d or 3d input a mini batch of 1d,0,0,Expand,applies batch normalization over a 2d or 3d input a mini batch of 1d
3604,Path,handle it returns just the filename.,0,0,Expand,handle it returns just the filename
685,ParentWithDependentChildren,model where the validation of child foreign key relationships depends,0,0,Expand,model where the validation of child foreign key relationships depends
3617,Path,"param readable if true, a readable check is performed.",0,0,Expand,param readable if true a readable check is performed
3705,PrefixLoader,"app1 packageloader mypackage^app1 ,",0,0,Expand,app1 packageloader mypackage app1
138,BaseCommand,to validate an individual application s models,0,0,Expand,to validate an individual application s models
3732,Request,param method http method to use.,0,0,Expand,param method http method to use
5255,LBFGS,if it doesn t fit in memory,0,0,Expand,if it doesn t fit in memory
5648,TransformerEncoderLayer,in advances in,0,0,Expand,in advances in
4755,Conv3d,kernel size int or tuple size of the convolving kernel,0,0,Expand,kernel size int or tuple size of the convolving kernel
1223,_MockPOP3,pm^iterkeys,0,0,Expand,pm iterkeys
2577,Environment,the string marking the beginning of a block.,0,0,Expand,the string marking the beginning of a block
5630,TaskOutput,represents the output of a task.,0,0,Expand,represents the output of a task
4503,BCEWithLogitsLoss,args,0,0,Expand,args
3663,PipError,base pip exception,0,0,Expand,base pip exception
508,MigrationGraph,merely a convention to aid file listing.,0,0,Expand,merely a convention to aid file listing
5702,Unfold,how the sliding blocks are retrieved.,0,0,Expand,how the sliding blocks are retrieved
2936,HebrewProber,the two sbcharsetprobers identify that the text is in,0,0,Expand,the two sbcharsetprobers identify that the text is in
1474,Rescan,add new messages to index,0,0,Expand,add new messages to index
5120,EmbeddingBag,"input torch^longtensor 1,2,4,5,4,3,2,9",0,0,Expand,input torch longtensor 1 2 4 5 4 3 2 9
5514,SGD,"momentum float, optional momentum factor default 0",0,0,Expand,momentum float optional momentum factor default 0
1512,VCardStore,u dude,0,0,Expand,u dude
1904,IntegerArray,"length 3, dtype int32",0,0,Expand,length 3 dtype int32
1303,ConfigDict,pot potatoes,0,0,Expand,pot potatoes
1265,AutoTlsConnBroker,"this broker tries to auto upgrade connections to use tls, or at",0,0,Expand,this broker tries to auto upgrade connections to use tls or at
5939,PreparedRequest,r req^prepare,0,0,Expand,r req prepare
2277,StringArray,"this is , some text , na, data.",0,0,Expand,this is some text na data
1484,StorageBackedLongs,"unpacklonglist storage sbl 1, 2",0,0,Expand,unpacklonglist storage sbl 1 2
3606,Path,basic checks about what the file or directory should be.,0,0,Expand,basic checks about what the file or directory should be
3822,Retry,set to none to remove this constraint and fall back on other,0,0,Expand,set to none to remove this constraint and fall back on other
948,Audio,normalize bool,0,0,Expand,normalize bool
5729,Unfold,class torch^nn.unfold extracts the values in the local blocks by,0,0,Expand,class torch nn unfold extracts the values in the local blocks by
4047,SkipTo,issue num 101,0,0,Expand,issue num 101
2546,DataViewSequence,a sequence of data views.,0,0,Expand,a sequence of data views
2547,DataViewSequence,each entry is an instance of item class .,0,0,Expand,each entry is an instance of item class
